{
  "schema_version": "1",
  "lease_id": "lease-20260721T160000Z-abcd",
  "environment": "production",
  "issued_at": "2026-07-21T16:00:00Z",
  "expires_at": "2020-01-01T00:00:00Z",
  "actor": "operator",
  "controller": "Dokploy",
  "action": "metadata_reconciliation",
  "expected_bundle_id": "wrb-20260721T155624Z-be643a429-sf54d1802",
  "expected_backend_digest": "sha256:8fa5b643b222afda217733d2c652942b7b4fecb12d3d19aef143f55d86efdf17",
  "expected_storefront_digest": "sha256:f493381a466b94956e62ccc9c3617731e91fcbace54ae648bbdfbbd711f33347",
  "target_bundle_id": "wrb-20260721T155624Z-be643a429-sf54d1802",
  "lock_path": "/srv/woodright/locks/live-cutover.lock",
  "transaction_id": "ctx-20260721T160000Z-meta",
  "single_use": true,
  "status": "issued",
  "now_iso": "2026-07-21T16:00:00Z",
  "observed_bundle_id": "wrb-20260721T155624Z-be643a429-sf54d1802",
  "observed_backend_digest": "sha256:8fa5b643b222afda217733d2c652942b7b4fecb12d3d19aef143f55d86efdf17",
  "observed_storefront_digest": "sha256:f493381a466b94956e62ccc9c3617731e91fcbace54ae648bbdfbbd711f33347"
}
